B1: 男籃 | C1: 女籃 | D1: 男排 | E1: 女排 | F1: 羽球 | G1: 壘球 | H1: 足球 | I1: 桌球(團) | J1: 桌球(個) | K1: 撞球(個) | L1: 團體合計 | M1: 個人合計
A2: 國立臺灣大學 | B2: 2 | D2: 2 | E2: 1 | F2: 3 | G2: 1 | H2: 1 | I2: 4 | J2: 12 | L2: =SUM(B2:I2) -> 14 | M2: =SUM(J2:K2) -> 12
A3: 國立臺灣師範大學 | B3: 2 | C3: 2 | D3: 2 | E3: 1 | F3: 1 | G3: 1 | I3: 2 | J3: 6 | L3: =SUM(B3:I3) -> 11 | M3: =SUM(J3:K3) -> 6
A4: 國立中興大學 | B4: 1 | D4: 1 | E4: 1 | F4: 1 | G4: 2 | I4: 1 | J4: 1 | K4: 1 | L4: =SUM(B4:I4) -> 7 | M4: =SUM(J4:K4) -> 2
A5: 國立成功大學 | B5: 1 | D5: 1 | E5: 1 | F5: 1 | G5: 1 | H5: 1 | I5: 1 | J5: 3 | L5: =SUM(B5:I5) -> 7 | M5: =SUM(J5:K5) -> 3
A6: 東吳大學 | B6: 1 | K6: 2 | L6: =SUM(B6:I6) -> 1 | M6: =SUM(J6:K6) -> 2
A7: 中原大學 | B7: 3 | C7: 2 | D7: 1 | E7: 1 | F7: 2 | G7: 1 | I7: 1 | J7: 2 | K7: 10 | L7: =SUM(B7:I7) -> 11 | M7: =SUM(J7:K7) -> 12
A8: 國立清華大學 | B8: 2 | C8: 2 | D8: 1 | E8: 1 | F8: 1 | G8: 1 | H8: 2 | I8: 1 | J8: 3 | K8: 5 | L8: =SUM(B8:I8) -> 11 | M8: =SUM(J8:K8) -> 8
A9: 國立交通大學 | D9: 1 | F9: 2 | L9: =SUM(B9:I9) -> 3 | M9: =SUM(J9:K9) -> 0
A10: 淡江大學 | B10: 2 | D10: 2 | F10: 1 | G10: 1 | K10: 4 | L10: =SUM(B10:I10) -> 6 | M10: =SUM(J10:K10) -> 4
A11: 國立中央大學 | B11: 3 | D11: 1 | E11: 1 | F11: 1 | G11: 1 | H11: 1 | I11: 1 | J11: 3 | L11: =SUM(B11:I11) -> 9 | M11: =SUM(J11:K11) -> 3
A12: 中國文化大學 | B12: 1 | E12: 1 | F12: 1 | G12: 1 | J12: 3 | K12: 2 | L12: =SUM(B12:I12) -> 4 | M12: =SUM(J12:K12) -> 5
A13: 輔仁大學 | B13: 2 | H13: 1 | K13: 5 | L13: =SUM(B13:I13) -> 3 | M13: =SUM(J13:K13) -> 5
A14: 國立高雄師範大學 | B14: 1 | E14: 1 | F14: 1 | J14: 3 | L14: =SUM(B14:I14) -> 3 | M14: =SUM(J14:K14) -> 3
A15: 國立彰化師範大學 | B15: 2 | D15: 1 | F15: 1 | G15: 1 | H15: 2 | I15: 2 | K15: 3 | L15: =SUM(B15:I15) -> 9 | M15: =SUM(J15:K15) -> 3
A16: 國立中山大學 | B16: 1 | D16: 1 | F16: 1 | G16: 1 | L16: =SUM(B16:I16) -> 4 | M16: =SUM(J16:K16) -> 0
A17: 國立中正大學 | B17: 2 | C17: 1 | D17: 1 | E17: 1 | F17: 2 | G17: 1 | H17: 1 | J17: 1 | K17: 1 | L17: =SUM(B17:I17) -> 9 | M17: =SUM(J17:K17) -> 2
A18: 國立東華大學 | B18: 1 | D18: 1 | G18: 1 | I18: 2 | K18: 1 | L18: =SUM(B18:I18) -> 5 | M18: =SUM(J18:K18) -> 1
A19: 國立高雄大學 | B19: 1 | D19: 1 | F19: 1 | G19: 1 | H19: 1 | J19: 3 | K19: 4 | L19: =SUM(B19:I19) -> 5 | M19: =SUM(J19:K19) -> 7
A20: 陸軍軍官學校 | B20: 1 | D20: 1 | G20: 1 | H20: 1 | L20: =SUM(B20:I20) -> 4 | M20: =SUM(J20:K20) -> 0
A21: 海軍軍官學校 | B21: 2 | D21: 1 | F21: 2 | G21: 1 | I21: 1 | L21: =SUM(B21:I21) -> 7 | M21: =SUM(J21:K21) -> 0
A22: 國立屏東師範學院 | B22: 1 | F22: 1 | L22: =SUM(B22:I22) -> 2 | M22: =SUM(J22:K22) -> 0
A23: 台中師範學院 | E23: 1 | F23: 1 | I23: 1 | L23: =SUM(B23:I23) -> 3 | M23: =SUM(J23:K23) -> 0
A24: 東海大學 | B24: 1 | G24: 1 | K24: 7 | L24: =SUM(B24:I24) -> 2 | M24: =SUM(J24:K24) -> 7
A25: 國立嘉義大學 | B25: 1 | C25: 1 | D25: 1 | F25: 1 | G25: 1 | J25: 3 | K25: 4 | L25: =SUM(B25:I25) -> 5 | M25: =SUM(J25:K25) -> 7
A26: 國立臺灣海洋大學 | L26: =SUM(B26:I26) -> 0 | M26: =SUM(J26:K26) -> 0
A27: 國防大學中正理工學院 | L27: =SUM(B27:I27) -> 0 | M27: =SUM(J27:K27) -> 0
A29: 報名費 | B29: 2800 | C29: 1000 | D29: 2300 | E29: 2300 | F29: 2600 | G29: 2900 | H29: 2700 | I29: 2200 | J29: 100 | K29: 200
A30: 隊數小計 | B30: =SUM(B2:B27) -> 34 | C30: =SUM(C2:C27) -> 8 | D30: =SUM(D2:D27) -> 20 | E30: =SUM(E2:E27) -> 11 | F30: =SUM(F2:F27) -> 25 | G30: =SUM(G2:G27) -> 19 | H30: =SUM(H2:H27) -> 11 | I30: =SUM(I2:I27) -> 17 | J30: =SUM(J2:J27) -> 43 | K30: =SUM(K2:K27) -> 49 | L30: =SUM(L2:L27) -> 145 | M30: =SUM(M2:M27) -> 92